{
  "identity": {
    "id": "COMPONENT-10002",
    "slug": "semantic-retriever",
    "name": {
      "official": "Semantic Retriever",
      "display": "Semantic Retriever"
    },
    "entityType": "Component",
    "keywords": [
      "semantic retrieval",
      "embedding retrieval",
      "retriever"
    ],
    "status": "Draft",
    "visibility": "Public",
    "language": "en",
    "version": "1.0.0"
  },
  "metadata": {
    "version": "1.0.0",
    "schemaVersion": "1.0.0",
    "repositoryVersion": "1.0.0",
    "status": "Draft",
    "reviewState": "Not Reviewed",
    "createdAt": "2026-07-13T00:00:00Z",
    "updatedAt": "2026-07-13T00:00:00Z",
    "createdBy": [
      {
        "type": "Automation",
        "name": "Codex",
        "role": "Seed data author"
      }
    ],
    "license": "Apache-2.0",
    "language": "en"
  },
  "description": {
    "summary": "A Semantic Retriever retrieves candidates using semantic representations such as embeddings.",
    "description": "A Semantic Retriever is a RAG component that retrieves candidate documents or chunks by comparing semantic representations, such as embeddings, for a query and indexed content."
  },
  "component": {
    "componentType": "Retriever",
    "ragStages": [
      "Retrieval"
    ],
    "abstractionLevel": "Conceptual",
    "interfaceRole": "Producer",
    "responsibilities": [
      "Retrieve candidate records using semantic representations such as embeddings."
    ],
    "inputs": [
      {
        "name": "Query",
        "dataType": "Query",
        "required": true,
        "description": "The search query represented or transformed for semantic matching."
      }
    ],
    "outputs": [
      {
        "name": "Candidate ranking",
        "dataType": "Ranking",
        "required": true,
        "description": "A ranked candidate list produced by semantic matching."
      }
    ]
  }
}
